{
  "$schema": "../../../schemas/language/lexical-trivia-source-root-evidence-r1.schema.json",
  "schema": "deeplus.lexical-trivia-source-root-evidence/r1",
  "revision": "r55-local-lexical-trivia-source-root-closure-r1",
  "canonical_baseline_commit": "39a5d50cc770341c4b9776d00d84520b780d0c62",
  "local_predecessor_commit": "89ded1ab5c9110476f7043e5f44b71ddd72d19a1",
  "candidate_status": "NONCANONICAL_DESIGN_STATIC_EVIDENCE_OVERLAY",
  "feature_ids": [
    "comment_trivia_lexical_priority_law",
    "documentation_comment_trivia",
    "line_comment_double_slash_trivia",
    "nested_block_comment_slash_dash_trivia",
    "r51a1_machine_closed_lexical_modes",
    "shebang_comment_first_line_trivia",
    "source_root_full_consumption",
    "word_comment_lossless_trivia",
    "word_comment_tokenization_law"
  ],
  "evidence_entries": [
    {
      "evidence_key": "R55:comment_trivia_lexical_priority_law:AST_FRONTEND:STRUCTURAL",
      "class": "CONTRACT_RULE_ID",
      "path": "spec/contracts/lexical-trivia-source-root-attachment-r1.json",
      "locator_kind": "REGISTRY_ID",
      "locator": "CommentOpenerPriorityDeterministic",
      "stage_role": "AST_FRONTEND"
    },
    {
      "evidence_key": "R55:comment_trivia_lexical_priority_law:CONFORMANCE_TESTS:BOUNDARY",
      "class": "ACCEPTANCE_CASE",
      "path": "spec/contracts/lexical-trivia-source-root-attachment-r1.json",
      "locator_kind": "JSON_POINTER",
      "locator": "/new_acceptance_cases/1",
      "stage_role": "CONFORMANCE_TESTS:BOUNDARY"
    },
    {
      "evidence_key": "R55:comment_trivia_lexical_priority_law:CONFORMANCE_TESTS:POSITIVE",
      "class": "ACCEPTANCE_CASE",
      "path": "spec/contracts/lexical-trivia-source-root-attachment-r1.json",
      "locator_kind": "JSON_POINTER",
      "locator": "/new_acceptance_cases/0",
      "stage_role": "CONFORMANCE_TESTS:POSITIVE"
    },
    {
      "evidence_key": "R55:comment_trivia_lexical_priority_law:CONFORMANCE_TESTS:REJECT",
      "class": "ACCEPTANCE_CASE",
      "path": "spec/contracts/lexical-trivia-source-root-attachment-r1.json",
      "locator_kind": "JSON_POINTER",
      "locator": "/new_acceptance_cases/2",
      "stage_role": "CONFORMANCE_TESTS:REJECT"
    },
    {
      "evidence_key": "R55:comment_trivia_lexical_priority_law:DYNAMIC_LOWERING:STRUCTURAL",
      "class": "CONTRACT_RULE_ID",
      "path": "spec/contracts/lexical-trivia-source-root-attachment-r1.json",
      "locator_kind": "REGISTRY_ID",
      "locator": "CommentOpenerPriorityDeterministic",
      "stage_role": "DYNAMIC_LOWERING"
    },
    {
      "evidence_key": "R55:comment_trivia_lexical_priority_law:STATIC_SEMANTICS:STRUCTURAL",
      "class": "CONTRACT_RULE_ID",
      "path": "spec/contracts/lexical-trivia-source-root-attachment-r1.json",
      "locator_kind": "REGISTRY_ID",
      "locator": "CommentOpenerPriorityDeterministic",
      "stage_role": "STATIC_SEMANTICS"
    },
    {
      "evidence_key": "R55:documentation_comment_trivia:AST_FRONTEND:STRUCTURAL",
      "class": "CONTRACT_RULE_ID",
      "path": "spec/contracts/lexical-trivia-source-root-attachment-r1.json",
      "locator_kind": "REGISTRY_ID",
      "locator": "DocumentationCommentAttachmentAdmitted",
      "stage_role": "AST_FRONTEND"
    },
    {
      "evidence_key": "R55:documentation_comment_trivia:CONFORMANCE_TESTS:BOUNDARY",
      "class": "ACCEPTANCE_CASE",
      "path": "spec/contracts/lexical-trivia-source-root-attachment-r1.json",
      "locator_kind": "JSON_POINTER",
      "locator": "/new_acceptance_cases/3",
      "stage_role": "CONFORMANCE_TESTS:BOUNDARY"
    },
    {
      "evidence_key": "R55:documentation_comment_trivia:CONFORMANCE_TESTS:REJECT",
      "class": "ACCEPTANCE_CASE",
      "path": "spec/contracts/lexical-trivia-source-root-attachment-r1.json",
      "locator_kind": "JSON_POINTER",
      "locator": "/new_acceptance_cases/4",
      "stage_role": "CONFORMANCE_TESTS:REJECT"
    },
    {
      "evidence_key": "R55:documentation_comment_trivia:STATIC_SEMANTICS:STRUCTURAL",
      "class": "CONTRACT_RULE_ID",
      "path": "spec/contracts/lexical-trivia-source-root-attachment-r1.json",
      "locator_kind": "REGISTRY_ID",
      "locator": "DocumentationCommentAttachmentAdmitted",
      "stage_role": "STATIC_SEMANTICS"
    },
    {
      "evidence_key": "R55:line_comment_double_slash_trivia:AST_FRONTEND:STRUCTURAL",
      "class": "CONTRACT_RULE_ID",
      "path": "spec/contracts/lexical-trivia-source-root-attachment-r1.json",
      "locator_kind": "REGISTRY_ID",
      "locator": "CstTriviaErasedBeforeNormalizedAst",
      "stage_role": "AST_FRONTEND"
    },
    {
      "evidence_key": "R55:line_comment_double_slash_trivia:CONFORMANCE_TESTS:BOUNDARY",
      "class": "TEACHING_EXAMPLE_ID",
      "path": "examples/guide/review-corpus.md",
      "locator_kind": "REGISTRY_ID",
      "locator": "EX-R48L-COMMENT-007",
      "stage_role": "CONFORMANCE_TESTS:BOUNDARY"
    },
    {
      "evidence_key": "R55:line_comment_double_slash_trivia:CONFORMANCE_TESTS:REJECT",
      "class": "CONTRACT_RULE_ID",
      "path": "spec/contracts/lexical-trivia-source-root-attachment-r1.json",
      "locator_kind": "REGISTRY_ID",
      "locator": "LineCommentHasNoDistinctRejectClass",
      "stage_role": "CONFORMANCE_TESTS:REJECT"
    },
    {
      "evidence_key": "R55:line_comment_double_slash_trivia:STATIC_SEMANTICS:STRUCTURAL",
      "class": "CONTRACT_RULE_ID",
      "path": "spec/contracts/lexical-trivia-source-root-attachment-r1.json",
      "locator_kind": "REGISTRY_ID",
      "locator": "LexicalTriviaHasNoStaticSemanticEffect",
      "stage_role": "STATIC_SEMANTICS"
    },
    {
      "evidence_key": "R55:nested_block_comment_slash_dash_trivia:AST_FRONTEND:STRUCTURAL",
      "class": "CONTRACT_RULE_ID",
      "path": "spec/contracts/lexical-trivia-source-root-attachment-r1.json",
      "locator_kind": "REGISTRY_ID",
      "locator": "CstTriviaErasedBeforeNormalizedAst",
      "stage_role": "AST_FRONTEND"
    },
    {
      "evidence_key": "R55:nested_block_comment_slash_dash_trivia:CONFORMANCE_TESTS:BOUNDARY",
      "class": "TEACHING_EXAMPLE_ID",
      "path": "examples/guide/review-corpus.md",
      "locator_kind": "REGISTRY_ID",
      "locator": "EX-R51a1-058",
      "stage_role": "CONFORMANCE_TESTS:BOUNDARY"
    },
    {
      "evidence_key": "R55:nested_block_comment_slash_dash_trivia:CONFORMANCE_TESTS:REJECT",
      "class": "ACCEPTANCE_CASE",
      "path": "spec/contracts/lexical-trivia-source-root-attachment-r1.json",
      "locator_kind": "JSON_POINTER",
      "locator": "/new_acceptance_cases/5",
      "stage_role": "CONFORMANCE_TESTS:REJECT"
    },
    {
      "evidence_key": "R55:nested_block_comment_slash_dash_trivia:STATIC_SEMANTICS:STRUCTURAL",
      "class": "CONTRACT_RULE_ID",
      "path": "spec/contracts/lexical-trivia-source-root-attachment-r1.json",
      "locator_kind": "REGISTRY_ID",
      "locator": "LexicalTriviaHasNoStaticSemanticEffect",
      "stage_role": "STATIC_SEMANTICS"
    },
    {
      "evidence_key": "R55:r51a1_machine_closed_lexical_modes:AST_FRONTEND:STRUCTURAL",
      "class": "CONTRACT_RULE_ID",
      "path": "spec/contracts/lexical-trivia-source-root-attachment-r1.json",
      "locator_kind": "REGISTRY_ID",
      "locator": "CstTriviaErasedBeforeNormalizedAst",
      "stage_role": "AST_FRONTEND"
    },
    {
      "evidence_key": "R55:r51a1_machine_closed_lexical_modes:CONFORMANCE_TESTS:BOUNDARY",
      "class": "TEACHING_EXAMPLE_ID",
      "path": "examples/guide/review-corpus.md",
      "locator_kind": "REGISTRY_ID",
      "locator": "EX-R51a1-051",
      "stage_role": "CONFORMANCE_TESTS:BOUNDARY"
    },
    {
      "evidence_key": "R55:r51a1_machine_closed_lexical_modes:CONFORMANCE_TESTS:REJECT",
      "class": "TEACHING_EXAMPLE_ID",
      "path": "examples/guide/review-corpus.md",
      "locator_kind": "REGISTRY_ID",
      "locator": "EX-R51a1-NG-043",
      "stage_role": "CONFORMANCE_TESTS:REJECT"
    },
    {
      "evidence_key": "R55:r51a1_machine_closed_lexical_modes:DYNAMIC_LOWERING:STRUCTURAL",
      "class": "CONTRACT_RULE_ID",
      "path": "spec/contracts/lexical-trivia-source-root-attachment-r1.json",
      "locator_kind": "REGISTRY_ID",
      "locator": "LexicalTriviaHasNoDynamicLowering",
      "stage_role": "DYNAMIC_LOWERING"
    },
    {
      "evidence_key": "R55:r51a1_machine_closed_lexical_modes:STATIC_SEMANTICS:STRUCTURAL",
      "class": "CONTRACT_RULE_ID",
      "path": "spec/contracts/lexical-trivia-source-root-attachment-r1.json",
      "locator_kind": "REGISTRY_ID",
      "locator": "CstTriviaErasedBeforeNormalizedAst",
      "stage_role": "STATIC_SEMANTICS"
    },
    {
      "evidence_key": "R55:shebang_comment_first_line_trivia:AST_FRONTEND:STRUCTURAL",
      "class": "CONTRACT_RULE_ID",
      "path": "spec/contracts/lexical-trivia-source-root-attachment-r1.json",
      "locator_kind": "REGISTRY_ID",
      "locator": "CstTriviaErasedBeforeNormalizedAst",
      "stage_role": "AST_FRONTEND"
    },
    {
      "evidence_key": "R55:shebang_comment_first_line_trivia:CONFORMANCE_TESTS:BOUNDARY",
      "class": "ACCEPTANCE_CASE",
      "path": "spec/contracts/lexical-trivia-source-root-attachment-r1.json",
      "locator_kind": "JSON_POINTER",
      "locator": "/new_acceptance_cases/6",
      "stage_role": "CONFORMANCE_TESTS:BOUNDARY"
    },
    {
      "evidence_key": "R55:shebang_comment_first_line_trivia:CONFORMANCE_TESTS:REJECT",
      "class": "ACCEPTANCE_CASE",
      "path": "spec/contracts/lexical-trivia-source-root-attachment-r1.json",
      "locator_kind": "JSON_POINTER",
      "locator": "/new_acceptance_cases/7",
      "stage_role": "CONFORMANCE_TESTS:REJECT"
    },
    {
      "evidence_key": "R55:shebang_comment_first_line_trivia:STATIC_SEMANTICS:STRUCTURAL",
      "class": "CONTRACT_RULE_ID",
      "path": "spec/contracts/lexical-trivia-source-root-attachment-r1.json",
      "locator_kind": "REGISTRY_ID",